{"allowed_uri_schemes":["http","https","mailto","tel"],"contract":"typaxis.contract/1.4","data_versions":{"japanese_line_break":"typaxis-jlreq-horizontal/1.0.0","unicode":"16.0.0"},"deterministic":true,"limits":{"max_ast_nesting_depth":64,"max_ast_nodes":1000000,"max_cff_charstring_operations":10000000,"max_cff_outline_segments":5000000,"max_cff_subroutines":100000,"max_cids_per_font":65535,"max_column_balance_candidates":16,"max_decoded_image_bytes":536870912,"max_document_package_bytes":134217728,"max_float_carry_pages":16,"max_float_queue":1024,"max_font_bytes":134217728,"max_font_glyphs":65535,"max_font_subset_bytes":134217728,"max_font_tables":64,"max_fonts":1,"max_footnote_reflows_per_page":8,"max_fragments":10000000,"max_image_bytes":134217728,"max_image_pixels":100000000,"max_images":8192,"max_include_depth":1,"max_include_files":1,"max_input_bytes":67108864,"max_json_nesting_depth":256,"max_layout_passes":8,"max_line_reshape_passes":4,"max_math_layout_units":1000000,"max_output_bytes":1073741824,"max_page_break_lookback":128,"max_pages":10000,"max_pdf_objects":1000000,"max_resource_bytes":1073741824,"max_shaping_context_bytes":65536,"max_source_bytes":67108864,"max_spool_bytes":1073741824,"max_style_rules":100000,"max_text_buffer_bytes":16777216,"max_text_bytes":67108864,"max_uri_bytes":8192,"max_vector_nesting_depth":32,"max_vector_nodes":262144,"max_vector_path_segments":4000000},"pdf_stream_compression":"none","resource_roots":[],"strict":true}